[
  {
    "id": "baseline.cell.handover",
    "datum": "Cell mast handovers logged as the handset moves between masts",
    "holder_type": "mobile_network_operator",
    "holder_examples": [],
    "kind": "emitted",
    "mechanism": "Network signalling generated automatically to route calls and data, kept as call- and session-detail records",
    "conditions": [
      "Applies to any switched-on handset registered to a network",
      "Retention length is set by national law where a retention notice is in force"
    ],
    "jurisdictions": ["UK"],
    "confidence": "documented",
    "sources": [
      {
        "title": "Investigatory Powers Act 2016, Section 87: Data retention notices",
        "publisher": "UK Public General Acts, legislation.gov.uk",
        "url": "https://www.legislation.gov.uk/ukpga/2016/25/section/87",
        "date": "2016-11-29",
        "type": "regulatory"
      }
    ],
    "tags": ["telecom", "location", "baseline"]
  },
  {
    "id": "baseline.wifi_bluetooth.beacon",
    "datum": "Wifi and Bluetooth probe requests broadcast to nearby receivers",
    "holder_type": "retail_venue_analytics",
    "holder_examples": [],
    "kind": "emitted",
    "mechanism": "Handsets periodically broadcast probe requests carrying a MAC address, which street furniture or venue sensors log as footfall",
    "conditions": [
      "Applies where a venue, street furniture or vehicle operates wifi/Bluetooth sensors",
      "Modern handsets randomise the MAC address by default, which reduces but does not eliminate linkability across sightings"
    ],
    "jurisdictions": ["UK"],
    "confidence": "reported",
    "sources": [
      {
        "title": "London Puts Stop To Sidewalk Bins That Track Cellphones",
        "publisher": "NPR",
        "url": "https://www.npr.org/sections/thetwo-way/2013/08/12/211368209/london-puts-stop-to-sidewalk-bins-that-track-cellphones",
        "date": "2013-08-12",
        "type": "journalism"
      }
    ],
    "tags": ["wifi", "bluetooth", "retail", "baseline"]
  },
  {
    "id": "baseline.appopen.sequence",
    "datum": "Which apps are opened, in what order, and for how long",
    "holder_type": "handset_os_vendor",
    "holder_examples": ["Apple", "Google"],
    "kind": "emitted",
    "mechanism": "Usage logging built into the operating system, surfaced to the person through a screen-time dashboard",
    "conditions": [
      "Built into the handset operating system",
      "Whether a copy leaves the device depends on the person's diagnostics and analytics settings"
    ],
    "jurisdictions": [],
    "confidence": "documented",
    "sources": [
      {
        "title": "Get started with Screen Time on iPhone",
        "publisher": "Apple",
        "url": "https://support.apple.com/guide/iphone/get-started-with-screen-time-iphbfa595995/ios",
        "date": "2026",
        "type": "vendor_doc"
      },
      {
        "title": "Manage how you spend time on your Android phone with Digital Wellbeing",
        "publisher": "Google",
        "url": "https://support.google.com/android/answer/9346420",
        "date": "2026",
        "type": "vendor_doc"
      }
    ],
    "tags": ["handset", "usage", "baseline"]
  },
  {
    "id": "baseline.home_work.inferred",
    "datum": "Home and work locations, inferred from where the handset dwells overnight and by day",
    "holder_type": "adtech_data_broker",
    "holder_examples": [],
    "kind": "inferred",
    "mechanism": "Location pings clustered by dwell time and time of day; never entered by the person",
    "conditions": [
      "Requires some source of location signal reaching a broker: an app SDK, wifi lookup, or cell data"
    ],
    "jurisdictions": [],
    "confidence": "modelled",
    "sources": [],
    "tags": ["location", "inference", "baseline"]
  },

  {
    "id": "transit.card.tap",
    "datum": "Card tap at boarding or barrier, with time and stop",
    "holder_type": "transit_operator",
    "holder_examples": ["Transport for London"],
    "kind": "emitted",
    "mechanism": "The fare system logs each tap to calculate the fare and detect incomplete journeys",
    "conditions": [
      "Applies to smartcard and contactless fare systems",
      "TfL journey data is de-personalised roughly eight weeks after the trip; payment card details tied to an account can be held up to 18 months"
    ],
    "jurisdictions": ["UK"],
    "confidence": "documented",
    "sources": [
      {
        "title": "Oyster card — how we use your personal information",
        "publisher": "Transport for London",
        "url": "https://tfl.gov.uk/corporate/privacy-and-cookies/oyster-card",
        "date": "2026",
        "type": "vendor_doc"
      }
    ],
    "tags": ["transport", "payment"]
  },
  {
    "id": "transit.cctv.onboard",
    "datum": "Onboard and platform CCTV",
    "holder_type": "transit_operator",
    "holder_examples": [],
    "kind": "emitted",
    "mechanism": "Continuous recording, retained on a fixed schedule and disclosed to police on request",
    "conditions": ["Applies where the operator runs onboard or platform cameras"],
    "jurisdictions": [],
    "confidence": "modelled",
    "sources": [],
    "tags": ["transport", "video"]
  },
  {
    "id": "transit.inferred.commute_pattern",
    "datum": "Commuting pattern and likely shift hours",
    "holder_type": "transit_operator",
    "holder_examples": [],
    "kind": "inferred",
    "mechanism": "Derived from the regularity of tap times and routes across weeks",
    "conditions": [],
    "jurisdictions": [],
    "confidence": "modelled",
    "sources": [],
    "tags": ["transport", "inference"]
  },
  {
    "id": "transit.inferred.income_band",
    "datum": "Household income band, correlated from route and stop",
    "holder_type": "adtech_data_broker",
    "holder_examples": [],
    "kind": "inferred",
    "mechanism": "Stop and postcode-level correlation used as a proxy for income",
    "conditions": [],
    "jurisdictions": [],
    "confidence": "modelled",
    "sources": [],
    "tags": ["transport", "inference"]
  },
  {
    "id": "transit.relational.bystanders",
    "datum": "Other passengers captured in the same CCTV frames",
    "holder_type": "transit_operator",
    "holder_examples": [],
    "kind": "relational",
    "mechanism": "A fixed camera records everyone in frame, not only the account holder",
    "conditions": [],
    "jurisdictions": [],
    "confidence": "modelled",
    "sources": [],
    "tags": ["transport", "relational"]
  },
  {
    "id": "transit.relational.segment",
    "datum": "Placement in a commuter advertising segment built from strangers' data",
    "holder_type": "adtech_data_broker",
    "holder_examples": [],
    "kind": "relational",
    "mechanism": "Segments are trained on aggregate behaviour across many riders, then applied back to an individual",
    "conditions": [],
    "jurisdictions": [],
    "confidence": "modelled",
    "sources": [],
    "tags": ["transport", "relational", "advertising"]
  },

  {
    "id": "payment.card.transaction",
    "datum": "Merchant, amount, time, and terminal ID",
    "holder_type": "bank_card_network",
    "holder_examples": [],
    "kind": "emitted",
    "mechanism": "Logged by the card network and issuing bank to authorise and settle the payment",
    "conditions": [],
    "jurisdictions": [],
    "confidence": "modelled",
    "sources": [],
    "tags": ["payment"]
  },
  {
    "id": "payment.item.sku",
    "datum": "Item-level SKUs on the receipt, linked to an identity if a loyalty card is scanned",
    "holder_type": "retailer",
    "holder_examples": [],
    "kind": "emitted",
    "mechanism": "Point-of-sale system itemises the basket; loyalty accounts attach it to a customer record",
    "conditions": ["Requires a loyalty card or linked payment method to attach to an identity"],
    "jurisdictions": [],
    "confidence": "modelled",
    "sources": [],
    "tags": ["payment", "retail"]
  },
  {
    "id": "payment.store.dwell",
    "datum": "Store entry and dwell time on camera",
    "holder_type": "retailer",
    "holder_examples": [],
    "kind": "emitted",
    "mechanism": "In-store cameras and, increasingly, shelf sensors log presence and movement",
    "conditions": [],
    "jurisdictions": [],
    "confidence": "modelled",
    "sources": [],
    "tags": ["payment", "retail", "video"]
  },
  {
    "id": "payment.inferred.spending_profile",
    "datum": "Spending category profile and an estimate of disposable income",
    "holder_type": "bank_credit_bureau",
    "holder_examples": [],
    "kind": "inferred",
    "mechanism": "Built from the pattern of merchant categories over time",
    "conditions": [],
    "jurisdictions": [],
    "confidence": "modelled",
    "sources": [],
    "tags": ["payment", "inference"]
  },
  {
    "id": "payment.inferred.life_stage",
    "datum": "Life-stage flags — a new baby, a house move, an illness — inferred from a shift in basket composition",
    "holder_type": "retailer",
    "holder_examples": [],
    "kind": "inferred",
    "mechanism": "A shift in the mix of items bought is scored against known patterns for the life event",
    "conditions": [
      "The best-documented case involves one named US retailer's pregnancy-prediction program; the underlying technique is understood to generalise"
    ],
    "jurisdictions": ["US"],
    "confidence": "reported",
    "sources": [
      {
        "title": "How Companies Learn Your Secrets",
        "publisher": "The New York Times",
        "url": "https://www.nytimes.com/2012/02/19/magazine/shopping-habits.html",
        "date": "2012-02-19",
        "type": "journalism"
      }
    ],
    "tags": ["payment", "retail", "inference"]
  },
  {
    "id": "payment.relational.gift_shopping",
    "datum": "Anyone shopped for appears in the profile as the account holder's own habit",
    "holder_type": "retailer",
    "holder_examples": [],
    "kind": "relational",